{
  "id": "cleaner",
  "name": "垃圾清理",
  "description": "扫描临时文件、浏览器缓存、开发工具缓存与崩溃转储等位置，把勾选的文件移入回收站，也可以清空回收站",
  "version": "2.0.9",
  "author": "ZTools Team",
  "entry": "dist/index.js",
  "icon": "icon.svg",
  "category": [
    "系统工具"
  ],
  "permissions": [
    "fs",
    "system",
    "shell",
    "clipboard"
  ],
  "requireAdmin": false,
  "nativeComponents": [],
  "targets": [
    {
      "id": "windows-electron-any",
      "platform": "windows",
      "runtime": "electron",
      "arch": "any"
    }
  ]
}
