{
  "id": "system-backup",
  "name": "系统备份",
  "description": "一键打包备份 Hosts、环境变量、SSH 密钥、终端与开发配置，换机或重装系统后秒级还原",
  "version": "2.0.6",
  "author": "ZTools Team",
  "entry": "dist/index.js",
  "icon": "icon.svg",
  "category": [
    "系统工具"
  ],
  "permissions": [
    "fs",
    "system"
  ],
  "requireAdmin": false,
  "nativeComponents": [],
  "targets": [
    {
      "id": "windows-electron-any",
      "platform": "windows",
      "runtime": "electron",
      "arch": "any"
    }
  ]
}
