{
  "id": "flow-guard",
  "name": "流量监控",
  "description": "实时查看各软件上传与下载网速、排查后台联网连接，支持一键限制软件网速或禁止联网",
  "version": "2.0.5",
  "author": "ZTools Team",
  "entry": "dist/index.js",
  "icon": "icon.svg",
  "category": [
    "系统工具",
    "网络工具"
  ],
  "permissions": [
    "network",
    "system"
  ],
  "requireAdmin": false,
  "nativeComponents": [],
  "targets": [
    {
      "id": "windows-electron-any",
      "platform": "windows",
      "runtime": "electron",
      "arch": "any"
    }
  ]
}
