{
  "id": "screenshot",
  "name": "截图历史与回贴",
  "description": "浏览本机截图目录，一键回贴、复制、定位与清理截图；可立即截取全部屏幕并复制到剪贴板",
  "version": "2.0.2",
  "author": "ZTools Team",
  "entry": "dist/index.js",
  "icon": "icon.svg",
  "category": [
    "办公效率",
    "图像媒体"
  ],
  "permissions": [
    "screen",
    "clipboard",
    "fs"
  ],
  "requireAdmin": false,
  "nativeComponents": [],
  "targets": [
    {
      "id": "windows-electron-any",
      "platform": "windows",
      "runtime": "electron",
      "arch": "any"
    },
    {
      "id": "macos-electron-any",
      "platform": "macos",
      "runtime": "electron",
      "arch": "any"
    }
  ]
}
